[
  {
    "source_id": "nhx-bilibili-read-case-30-cv27096113",
    "title": "Bilibili 专栏：倪海厦天纪第 30 集案例候选",
    "url": "https://www.bilibili.com/read/cv27096113/",
    "platform": "bilibili.com",
    "media_type": "article",
    "topic_tags": ["nihaixia", "tianji", "ziwei", "case_study", "episode", "bilibili_read"],
    "rights_status": "unknown_needs_review",
    "storage_policy": "metadata_only",
    "collection_actions": ["record_metadata", "manual_rights_review", "request_license", "do_not_store_fulltext"],
    "human_review_status": "needs_license",
    "risk_level": "medium",
    "publisher": "Bilibili author",
    "author_or_speaker": "unknown",
    "discovered_at": "2026-04-24",
    "discovered_via": "web_search:q-bilibili-read-case",
    "notes": "案例/分集学习笔记候选；只做 metadata，授权后才可摘录。"
  },
  {
    "source_id": "nhx-bilibili-video-case-25-bv1rihczaeea",
    "title": "Bilibili：倪海厦天纪紫微斗数篇 25 候选视频",
    "url": "https://www.bilibili.com/video/BV1RiHczAEeA/",
    "platform": "bilibili.com",
    "media_type": "video",
    "topic_tags": ["nihaixia", "tianji", "ziwei", "case_study", "episode", "video", "bilibili"],
    "rights_status": "unknown_needs_review",
    "storage_policy": "metadata_only",
    "collection_actions": ["record_metadata", "fetch_public_page_title", "manual_rights_review", "request_license", "do_not_download_media", "do_not_store_fulltext"],
    "human_review_status": "needs_license",
    "risk_level": "high",
    "publisher": "Bilibili uploader",
    "author_or_speaker": "倪海厦",
    "discovered_at": "2026-04-24",
    "discovered_via": "web_search:q-bilibili-read-case",
    "notes": "搜索结果显示“未经作者授权，禁止转载”；只登记 metadata。"
  },
  {
    "source_id": "nhx-bilibili-video-san-fang-si-zheng-bv1atuqzweqz",
    "title": "Bilibili：倪海厦紫微斗数三方四正候选视频",
    "url": "https://www.bilibili.com/video/BV1atuqzwEqz/",
    "platform": "bilibili.com",
    "media_type": "video",
    "topic_tags": ["nihaixia", "tianji", "ziwei", "san_fang_si_zheng", "video", "bilibili"],
    "rights_status": "unknown_needs_review",
    "storage_policy": "metadata_only",
    "collection_actions": ["record_metadata", "fetch_public_page_title", "manual_rights_review", "request_license", "do_not_download_media", "do_not_store_fulltext"],
    "human_review_status": "needs_license",
    "risk_level": "high",
    "publisher": "Bilibili uploader",
    "author_or_speaker": "倪海厦",
    "discovered_at": "2026-04-24",
    "discovered_via": "web_search:q-bilibili-read-case",
    "notes": "三方四正主题候选；不下载视频。"
  },
  {
    "source_id": "nhx-bilibili-video-children-health-bv1yu4y1v7sw",
    "title": "Bilibili：倪海厦天纪子女宫/疾厄宫分集候选",
    "url": "https://www.bilibili.com/video/BV1yu4y1v7SW/",
    "platform": "bilibili.com",
    "media_type": "video",
    "topic_tags": ["nihaixia", "tianji", "ziwei", "children", "health", "jier", "video", "bilibili"],
    "rights_status": "unknown_needs_review",
    "storage_policy": "metadata_only",
    "collection_actions": ["record_metadata", "fetch_public_page_title", "manual_rights_review", "request_license", "do_not_download_media", "do_not_store_fulltext"],
    "human_review_status": "needs_license",
    "risk_level": "high",
    "publisher": "Bilibili uploader",
    "author_or_speaker": "倪海厦",
    "discovered_at": "2026-04-24",
    "discovered_via": "web_search:q-bilibili-read-health",
    "notes": "搜索结果显示相关合集含子女宫、疾厄宫分集；只登记 metadata。"
  },
  {
    "source_id": "nhx-bilibili-video-si-hua-lu-bv1h14y1i7an",
    "title": "Bilibili：倪海厦天纪四化禄候选视频",
    "url": "https://www.bilibili.com/video/BV1H14y1i7An/",
    "platform": "bilibili.com",
    "media_type": "video",
    "topic_tags": ["nihaixia", "tianji", "ziwei", "sihua", "hualu", "video", "bilibili"],
    "rights_status": "unknown_needs_review",
    "storage_policy": "metadata_only",
    "collection_actions": ["record_metadata", "fetch_public_page_title", "manual_rights_review", "request_license", "do_not_download_media", "do_not_store_fulltext"],
    "human_review_status": "needs_license",
    "risk_level": "high",
    "publisher": "Bilibili uploader",
    "author_or_speaker": "倪海厦",
    "discovered_at": "2026-04-24",
    "discovered_via": "web_search:q-nihaixia-sihua-huaji",
    "notes": "四化禄主题候选；不下载媒体，不抓字幕。"
  },
  {
    "source_id": "nhx-bilibili-video-tianji-24-25-bv1qz421x7bw",
    "title": "Bilibili：倪海厦天纪 24-25 集候选视频",
    "url": "https://www.bilibili.com/video/BV1qz421X7bw/",
    "platform": "bilibili.com",
    "media_type": "video",
    "topic_tags": ["nihaixia", "tianji", "ziwei", "episode", "case_study", "video", "bilibili"],
    "rights_status": "unknown_needs_review",
    "storage_policy": "metadata_only",
    "collection_actions": ["record_metadata", "fetch_public_page_title", "manual_rights_review", "request_license", "do_not_download_media", "do_not_store_fulltext"],
    "human_review_status": "needs_license",
    "risk_level": "high",
    "publisher": "Bilibili uploader",
    "author_or_speaker": "倪海厦",
    "discovered_at": "2026-04-24",
    "discovered_via": "web_search:q-bilibili-read-case",
    "notes": "分集候选；只作为目录和人工核验线索。"
  },
  {
    "source_id": "nhx-bilibili-read-tianji-24-full-cv18118325",
    "title": "Bilibili 专栏：倪海厦天纪紫微斗数 24 集全候选",
    "url": "https://www.bilibili.com/read/cv18118325/",
    "platform": "bilibili.com",
    "media_type": "article",
    "topic_tags": ["nihaixia", "tianji", "ziwei", "course_collection", "bilibili_read"],
    "rights_status": "unknown_needs_review",
    "storage_policy": "metadata_only",
    "collection_actions": ["record_metadata", "manual_rights_review", "request_license", "do_not_store_fulltext"],
    "human_review_status": "needs_license",
    "risk_level": "medium",
    "publisher": "Bilibili author",
    "author_or_speaker": "unknown",
    "discovered_at": "2026-04-24",
    "discovered_via": "web_search:q-bilibili-read-and-video",
    "notes": "专栏/目录候选；不保存正文。"
  },
  {
    "source_id": "nhx-bilibili-video-audio-denoise-bv191pjzhe39",
    "title": "Bilibili：倪海厦天纪音频降噪版候选视频",
    "url": "https://www.bilibili.com/video/BV191PjzhE39/",
    "platform": "bilibili.com",
    "media_type": "video",
    "topic_tags": ["nihaixia", "tianji", "ziwei", "audio", "denoise", "video", "bilibili"],
    "rights_status": "unknown_needs_review",
    "storage_policy": "metadata_only",
    "collection_actions": ["record_metadata", "fetch_public_page_title", "manual_rights_review", "request_license", "do_not_download_media", "do_not_store_fulltext"],
    "human_review_status": "needs_license",
    "risk_level": "high",
    "publisher": "Bilibili uploader",
    "author_or_speaker": "倪海厦",
    "discovered_at": "2026-04-24",
    "discovered_via": "web_search:q-bilibili-read-and-video",
    "notes": "降噪版/再上传候选；只登记 metadata。"
  },
  {
    "source_id": "nhx-bilibili-video-beidou-sun-bv1qm4y1m7pa",
    "title": "Bilibili：倪海厦天纪北斗星系太阳星候选视频",
    "url": "https://www.bilibili.com/video/BV1qm4y1M7Pa/",
    "platform": "bilibili.com",
    "media_type": "video",
    "topic_tags": ["nihaixia", "tianji", "ziwei", "beidou", "sun_star", "video", "bilibili"],
    "rights_status": "unknown_needs_review",
    "storage_policy": "metadata_only",
    "collection_actions": ["record_metadata", "fetch_public_page_title", "manual_rights_review", "request_license", "do_not_download_media", "do_not_store_fulltext"],
    "human_review_status": "needs_license",
    "risk_level": "high",
    "publisher": "Bilibili uploader",
    "author_or_speaker": "倪海厦",
    "discovered_at": "2026-04-24",
    "discovered_via": "web_search:q-bilibili-read-and-video",
    "notes": "星曜主题分集候选；不下载视频或字幕。"
  },
  {
    "source_id": "nhx-bilibili-video-li-ri-jue-ri-bv13h4y1u7cr",
    "title": "Bilibili：倪海厦天纪离日绝日/择日主题候选视频",
    "url": "https://www.bilibili.com/video/BV13h4y1U7cr/",
    "platform": "bilibili.com",
    "media_type": "video",
    "topic_tags": ["nihaixia", "tianji", "zeri", "calendar", "video", "bilibili"],
    "rights_status": "unknown_needs_review",
    "storage_policy": "metadata_only",
    "collection_actions": ["record_metadata", "fetch_public_page_title", "manual_rights_review", "request_license", "do_not_download_media", "do_not_store_fulltext"],
    "human_review_status": "needs_license",
    "risk_level": "high",
    "publisher": "Bilibili uploader",
    "author_or_speaker": "倪海厦",
    "discovered_at": "2026-04-24",
    "discovered_via": "web_search:q-bilibili-read-and-video",
    "notes": "天纪择日相关候选；作为体系边界线索，不下载媒体。"
  }
]
