[
  {
    "source_id": "nhx-ixigua-tianji-6814830685698654724",
    "title": "西瓜视频：倪海厦天纪紫微斗数候选 6814830685698654724",
    "url": "https://www.ixigua.com/6814830685698654724",
    "platform": "ixigua.com",
    "media_type": "video",
    "topic_tags": ["nihaixia", "tianji", "ziwei", "video"],
    "rights_status": "unknown_needs_review",
    "storage_policy": "metadata_only",
    "collection_actions": ["record_metadata", "manual_rights_review", "request_license", "do_not_download_media", "do_not_store_fulltext"],
    "human_review_status": "needs_license",
    "risk_level": "high",
    "publisher": "Xigua uploader",
    "author_or_speaker": "倪海厦",
    "discovered_at": "2026-04-24",
    "discovered_via": "web_search:q-site-xigua-douyin",
    "notes": "西瓜视频候选；不下载媒体，不抓字幕。"
  },
  {
    "source_id": "nhx-ixigua-tianji-7335465550686421513",
    "title": "西瓜视频：倪海厦天纪紫微斗数候选 7335465550686421513",
    "url": "https://www.ixigua.com/7335465550686421513",
    "platform": "ixigua.com",
    "media_type": "video",
    "topic_tags": ["nihaixia", "tianji", "ziwei", "video", "case_study"],
    "rights_status": "unknown_needs_review",
    "storage_policy": "metadata_only",
    "collection_actions": ["record_metadata", "manual_rights_review", "request_license", "do_not_download_media", "do_not_store_fulltext"],
    "human_review_status": "needs_license",
    "risk_level": "high",
    "publisher": "Xigua uploader",
    "author_or_speaker": "倪海厦",
    "discovered_at": "2026-04-24",
    "discovered_via": "web_search:q-site-xigua-douyin",
    "notes": "西瓜视频候选；仅做目录线索。"
  },
  {
    "source_id": "nhx-ixigua-tianji-yijing-7143206008347689483",
    "title": "西瓜视频：倪海厦天纪易经/紫微体系边界候选",
    "url": "https://www.ixigua.com/7143206008347689483",
    "platform": "ixigua.com",
    "media_type": "video",
    "topic_tags": ["nihaixia", "tianji", "yijing", "ziwei", "video", "boundary"],
    "rights_status": "unknown_needs_review",
    "storage_policy": "metadata_only",
    "collection_actions": ["record_metadata", "manual_rights_review", "request_license", "do_not_download_media", "do_not_store_fulltext"],
    "human_review_status": "needs_license",
    "risk_level": "high",
    "publisher": "Xigua uploader",
    "author_or_speaker": "倪海厦",
    "discovered_at": "2026-04-24",
    "discovered_via": "web_search:q-site-xigua-douyin",
    "notes": "天纪体系边界候选；不下载媒体。"
  },
  {
    "source_id": "nhx-douyin-tianji-7393336740578151692",
    "title": "抖音：倪海厦天纪紫微斗数短视频候选 7393336740578151692",
    "url": "https://www.douyin.com/video/7393336740578151692",
    "platform": "douyin.com",
    "media_type": "video",
    "topic_tags": ["nihaixia", "tianji", "ziwei", "short_video", "douyin"],
    "rights_status": "unknown_needs_review",
    "storage_policy": "metadata_only",
    "collection_actions": ["record_metadata", "manual_rights_review", "request_license", "do_not_download_media", "do_not_store_fulltext"],
    "human_review_status": "needs_license",
    "risk_level": "high",
    "publisher": "Douyin uploader",
    "author_or_speaker": "倪海厦",
    "discovered_at": "2026-04-24",
    "discovered_via": "web_search:q-site-xigua-douyin",
    "notes": "短视频线索；只登记 URL 与元数据。"
  },
  {
    "source_id": "nhx-douyin-tianji-7442648966258265359",
    "title": "抖音：倪海厦天纪紫微斗数短视频候选 7442648966258265359",
    "url": "https://www.douyin.com/video/7442648966258265359",
    "platform": "douyin.com",
    "media_type": "video",
    "topic_tags": ["nihaixia", "tianji", "ziwei", "short_video", "douyin"],
    "rights_status": "unknown_needs_review",
    "storage_policy": "metadata_only",
    "collection_actions": ["record_metadata", "manual_rights_review", "request_license", "do_not_download_media", "do_not_store_fulltext"],
    "human_review_status": "needs_license",
    "risk_level": "high",
    "publisher": "Douyin uploader",
    "author_or_speaker": "倪海厦",
    "discovered_at": "2026-04-24",
    "discovered_via": "web_search:q-site-xigua-douyin",
    "notes": "短视频线索；不下载媒体。"
  },
  {
    "source_id": "nhx-douyin-tianji-7392081254272781606",
    "title": "抖音：倪海厦天纪紫微斗数短视频候选 7392081254272781606",
    "url": "https://www.douyin.com/video/7392081254272781606",
    "platform": "douyin.com",
    "media_type": "video",
    "topic_tags": ["nihaixia", "tianji", "ziwei", "short_video", "douyin"],
    "rights_status": "unknown_needs_review",
    "storage_policy": "metadata_only",
    "collection_actions": ["record_metadata", "manual_rights_review", "request_license", "do_not_download_media", "do_not_store_fulltext"],
    "human_review_status": "needs_license",
    "risk_level": "high",
    "publisher": "Douyin uploader",
    "author_or_speaker": "倪海厦",
    "discovered_at": "2026-04-24",
    "discovered_via": "web_search:q-site-xigua-douyin",
    "notes": "短视频线索；不下载媒体。"
  },
  {
    "source_id": "nhx-doc88-tianji-1866397436690",
    "title": "Doc88：倪海厦天纪文档候选 1866397436690",
    "url": "https://www.doc88.com/p-1866397436690.html",
    "platform": "doc88.com",
    "media_type": "webpage",
    "topic_tags": ["nihaixia", "tianji", "document", "pdf_candidate", "resource_risk"],
    "rights_status": "unknown_needs_review",
    "storage_policy": "metadata_only",
    "collection_actions": ["record_metadata", "manual_rights_review", "request_license", "do_not_store_fulltext"],
    "human_review_status": "needs_license",
    "risk_level": "high",
    "publisher": "doc88.com uploader",
    "author_or_speaker": "unknown",
    "discovered_at": "2026-04-24",
    "discovered_via": "web_search:q-nihaixia-tianji-pdf",
    "notes": "第三方文档平台候选；不下载文档，不保存正文。"
  },
  {
    "source_id": "nhx-doc88-tianji-7114130166002035",
    "title": "Doc88：倪海厦天纪资料候选 7114130166002035",
    "url": "https://www.doc88.com/p-7114130166002035.html",
    "platform": "doc88.com",
    "media_type": "webpage",
    "topic_tags": ["nihaixia", "tianji", "document", "pdf_candidate", "resource_risk"],
    "rights_status": "unknown_needs_review",
    "storage_policy": "metadata_only",
    "collection_actions": ["record_metadata", "manual_rights_review", "request_license", "do_not_store_fulltext"],
    "human_review_status": "needs_license",
    "risk_level": "high",
    "publisher": "doc88.com uploader",
    "author_or_speaker": "unknown",
    "discovered_at": "2026-04-24",
    "discovered_via": "web_search:q-nihaixia-tianji-pdf",
    "notes": "第三方文档平台候选；高风险，仅 metadata。"
  },
  {
    "source_id": "nhx-book118-tianji-pdf-7023026102002115",
    "title": "Book118：倪海厦天纪 PDF/讲义候选",
    "url": "https://max.book118.com/html/2023/0228/7023026102002115.shtm",
    "platform": "book118.com",
    "media_type": "webpage",
    "topic_tags": ["nihaixia", "tianji", "pdf_candidate", "lecture_note", "resource_risk"],
    "rights_status": "unknown_needs_review",
    "storage_policy": "metadata_only",
    "collection_actions": ["record_metadata", "manual_rights_review", "request_license", "do_not_store_fulltext"],
    "human_review_status": "needs_license",
    "risk_level": "high",
    "publisher": "book118.com uploader",
    "author_or_speaker": "unknown",
    "discovered_at": "2026-04-24",
    "discovered_via": "web_search:q-nihaixia-tianji-pdf",
    "notes": "第三方文档平台候选；不保存正文，不下载附件。"
  },
  {
    "source_id": "nhx-book118-tianji-creation-note-173227",
    "title": "Book118：天纪书籍创作说明候选",
    "url": "https://www.book118.com/html/2024/0911/8023070077006125.shtm",
    "platform": "book118.com",
    "media_type": "webpage",
    "topic_tags": ["nihaixia", "tianji", "background", "document", "resource_risk"],
    "rights_status": "unknown_needs_review",
    "storage_policy": "metadata_only",
    "collection_actions": ["record_metadata", "manual_rights_review", "request_license", "do_not_store_fulltext"],
    "human_review_status": "needs_license",
    "risk_level": "high",
    "publisher": "book118.com uploader",
    "author_or_speaker": "unknown",
    "discovered_at": "2026-04-24",
    "discovered_via": "web_search:q-nihaixia-tianji-pdf",
    "notes": "背景/文档候选；第三方平台，未授权前只登记 metadata。"
  }
]
