[
  {
    "source_id": "nhx-bilibili-list-ml79111146",
    "title": "Bilibili 列表：倪海厦天纪紫微斗数候选合集",
    "url": "https://www.bilibili.com/list/ml79111146",
    "platform": "bilibili.com",
    "media_type": "webpage",
    "topic_tags": ["nihaixia", "tianji", "ziwei", "bilibili", "playlist", "video"],
    "rights_status": "unknown_needs_review",
    "storage_policy": "metadata_only",
    "collection_actions": ["record_metadata", "manual_rights_review", "request_license", "do_not_download_media", "do_not_store_fulltext"],
    "human_review_status": "needs_license",
    "risk_level": "high",
    "publisher": "Bilibili uploader",
    "author_or_speaker": "倪海厦",
    "discovered_at": "2026-04-24",
    "discovered_via": "web_search:q-site-bilibili",
    "notes": "Bilibili 列表页候选；只用于人工确认分集目录，不下载视频或字幕。"
  },
  {
    "source_id": "nhx-douyin-tianji-7409888701565685043",
    "title": "抖音：倪海厦天纪紫微斗数短视频候选",
    "url": "https://www.douyin.com/video/7409888701565685043",
    "platform": "douyin.com",
    "media_type": "video",
    "topic_tags": ["nihaixia", "tianji", "ziwei", "douyin", "short_video"],
    "rights_status": "unknown_needs_review",
    "storage_policy": "metadata_only",
    "collection_actions": ["record_metadata", "manual_rights_review", "request_license", "do_not_download_media", "do_not_store_fulltext"],
    "human_review_status": "needs_license",
    "risk_level": "high",
    "publisher": "Douyin uploader",
    "author_or_speaker": "倪海厦",
    "discovered_at": "2026-04-24",
    "discovered_via": "web_search:q-site-xigua-douyin",
    "notes": "短视频平台候选；仅保留 URL 与元数据，需人工确认来源和授权。"
  },
  {
    "source_id": "nhx-baozangba-wenji-5640194-risk",
    "title": "宝藏吧：倪海厦文集 PDF 资源页候选",
    "url": "https://www.baozangba.com/5640194.html",
    "platform": "baozangba.com",
    "media_type": "webpage",
    "topic_tags": ["nihaixia", "wenji", "ziwei", "pdf_candidate", "resource_risk"],
    "rights_status": "prohibited",
    "storage_policy": "do_not_store",
    "collection_actions": ["record_metadata", "do_not_store_fulltext"],
    "human_review_status": "rejected",
    "risk_level": "blocked",
    "publisher": "baozangba.com",
    "author_or_speaker": "unknown",
    "discovered_at": "2026-04-24",
    "discovered_via": "web_search:q-nihaixia-tianji-pdf",
    "notes": "资源页/下载页风险线索，显式 blocked，避免后续自动抓取 PDF 或附件。"
  },
  {
    "source_id": "tianji-ziwei-appstore-us",
    "title": "App Store：天纪紫微斗数排盘应用",
    "url": "https://apps.apple.com/us/app/%E5%A4%A9%E7%BA%AA%E7%B4%AB%E5%BE%AE%E6%96%97%E6%95%B0/id6743829663",
    "platform": "apps.apple.com",
    "media_type": "webpage",
    "topic_tags": ["ziwei", "tianji", "app", "software", "reference"],
    "rights_status": "metadata_only",
    "storage_policy": "metadata_only",
    "collection_actions": ["record_metadata", "do_not_store_fulltext"],
    "human_review_status": "pending",
    "risk_level": "medium",
    "publisher": "Apple App Store",
    "author_or_speaker": "unknown",
    "discovered_at": "2026-04-24",
    "discovered_via": "web_search:q-nihaixia-tianji-pdf",
    "notes": "现代排盘工具候选，用于产品/竞品参考，不作为倪师原典证据。"
  },
  {
    "source_id": "ziwei-qian-tu-zwds001-pdf",
    "title": "紫微斗数 PDF 基础资料候选",
    "url": "https://www.qiangtu.com/doc/zwds001.pdf",
    "platform": "qiangtu.com",
    "media_type": "pdf",
    "topic_tags": ["ziwei", "pdf_candidate", "reference", "not_nihaixia_primary"],
    "rights_status": "unknown_needs_review",
    "storage_policy": "metadata_only",
    "collection_actions": ["record_metadata", "manual_rights_review", "request_license", "do_not_store_fulltext"],
    "human_review_status": "needs_license",
    "risk_level": "high",
    "publisher": "qiangtu.com",
    "author_or_speaker": "unknown",
    "discovered_at": "2026-04-24",
    "discovered_via": "web_search:q-nihaixia-tianji-pdf",
    "notes": "通用紫微斗数 PDF 候选，仅作旁证/术语对照线索；未授权前不下载、不全文入库。"
  },
  {
    "source_id": "ziwei-eight-s-fortune-tool",
    "title": "三藏算命：紫微斗数排盘参考工具",
    "url": "https://m.8s8s.com/fortune-telling.php",
    "platform": "8s8s.com",
    "media_type": "webpage",
    "topic_tags": ["ziwei", "tool", "reference", "not_nihaixia_primary"],
    "rights_status": "metadata_only",
    "storage_policy": "metadata_only",
    "collection_actions": ["record_metadata", "do_not_store_fulltext"],
    "human_review_status": "pending",
    "risk_level": "medium",
    "publisher": "8s8s.com",
    "author_or_speaker": "unknown",
    "discovered_at": "2026-04-24",
    "discovered_via": "web_search:q-nihaixia-tianji-pdf",
    "notes": "通用排盘/术语参考，不作为倪海厦体系原典证据。"
  },
  {
    "source_id": "ziwei-fushantang-study-steps",
    "title": "福山堂：紫微斗数学习步骤参考",
    "url": "http://www.fushantang.com/1005/1005a.html",
    "platform": "fushantang.com",
    "media_type": "article",
    "topic_tags": ["ziwei", "study_note", "reference", "not_nihaixia_primary"],
    "rights_status": "unknown_needs_review",
    "storage_policy": "metadata_only",
    "collection_actions": ["record_metadata", "manual_rights_review", "request_license", "do_not_store_fulltext"],
    "human_review_status": "needs_license",
    "risk_level": "medium",
    "publisher": "fushantang.com",
    "author_or_speaker": "unknown",
    "discovered_at": "2026-04-24",
    "discovered_via": "web_search:q-nihaixia-tianji-pdf",
    "notes": "通用紫微斗数学习路径参考；只做术语/体系对照线索。"
  },
  {
    "source_id": "ziwei-keledge-doushu-basic",
    "title": "斗数基础：通用紫微斗数学习资料候选",
    "url": "https://keledge.cduestc.cn/#/detail/67c559aebf52a16cd12dc3b5",
    "platform": "keledge.cduestc.cn",
    "media_type": "webpage",
    "topic_tags": ["ziwei", "study_note", "reference", "not_nihaixia_primary"],
    "rights_status": "unknown_needs_review",
    "storage_policy": "metadata_only",
    "collection_actions": ["record_metadata", "manual_rights_review", "request_license", "do_not_store_fulltext"],
    "human_review_status": "needs_license",
    "risk_level": "medium",
    "publisher": "keledge.cduestc.cn",
    "author_or_speaker": "unknown",
    "discovered_at": "2026-04-24",
    "discovered_via": "web_search:q-nihaixia-tianji-pdf",
    "notes": "通用参考资料，不能混作倪师原话或倪海厦体系 primary evidence。"
  },
  {
    "source_id": "nhx-toutiao-tianji-video-7081557661963076108",
    "title": "今日头条：倪海厦天纪紫微斗数视频线索",
    "url": "https://www.toutiao.com/article/7081557661963076108/",
    "platform": "toutiao.com",
    "media_type": "webpage",
    "topic_tags": ["nihaixia", "tianji", "ziwei", "video", "metadata_candidate"],
    "rights_status": "unknown_needs_review",
    "storage_policy": "metadata_only",
    "collection_actions": ["record_metadata", "manual_rights_review", "request_license", "do_not_download_media", "do_not_store_fulltext"],
    "human_review_status": "needs_license",
    "risk_level": "high",
    "publisher": "Toutiao uploader",
    "author_or_speaker": "倪海厦",
    "discovered_at": "2026-04-24",
    "discovered_via": "web_search:q-nihaixia-tianji-ziwei-video",
    "notes": "资讯/视频平台候选；不下载媒体，不保存正文或字幕。"
  }
]
