[
  {
    "source_id": "nhx-haokan-tianji-03-15523065258244906863",
    "title": "好看视频：倪海厦《天纪》03上 紫微斗数候选",
    "url": "https://haokan.baidu.com/v?vid=15523065258244906863",
    "platform": "haokan.baidu.com",
    "media_type": "video",
    "topic_tags": ["nihaixia", "tianji", "ziwei", "video", "haokan", "episode"],
    "rights_status": "unknown_needs_review",
    "storage_policy": "metadata_only",
    "collection_actions": ["record_metadata", "manual_rights_review", "request_license", "do_not_download_media", "do_not_store_fulltext"],
    "human_review_status": "needs_license",
    "risk_level": "high",
    "publisher": "Haokan uploader",
    "author_or_speaker": "倪海厦",
    "discovered_at": "2026-04-24",
    "discovered_via": "web_search:q-site-haokan-sohu-youku-iqiyi",
    "notes": "好看视频分集候选；不下载媒体，不抓字幕。"
  },
  {
    "source_id": "nhx-sohu-tianji-complete-188527793",
    "title": "搜狐视频：83集完整天纪课候选",
    "url": "https://tv.sohu.com/v/dXMvMzUwMTUwNjY2LzE4ODUyNzc5My5zaHRtbA==.html",
    "platform": "tv.sohu.com",
    "media_type": "video",
    "topic_tags": ["nihaixia", "tianji", "ziwei", "video", "sohu", "course_collection"],
    "rights_status": "unknown_needs_review",
    "storage_policy": "metadata_only",
    "collection_actions": ["record_metadata", "manual_rights_review", "request_license", "do_not_download_media", "do_not_store_fulltext"],
    "human_review_status": "needs_license",
    "risk_level": "high",
    "publisher": "Sohu uploader",
    "author_or_speaker": "倪海厦",
    "discovered_at": "2026-04-24",
    "discovered_via": "web_search:q-site-haokan-sohu-youku-iqiyi",
    "notes": "搜狐视频全集入口候选；只登记 metadata。"
  },
  {
    "source_id": "nhx-youku-tianji-album-49663234",
    "title": "优酷：倪海厦天纪专辑候选 49663234",
    "url": "https://www.youku.com/albumlist/show/id_49663234.html",
    "platform": "youku.com",
    "media_type": "webpage",
    "topic_tags": ["nihaixia", "tianji", "ziwei", "video", "youku", "playlist"],
    "rights_status": "unknown_needs_review",
    "storage_policy": "metadata_only",
    "collection_actions": ["record_metadata", "manual_rights_review", "request_license", "do_not_download_media", "do_not_store_fulltext"],
    "human_review_status": "needs_license",
    "risk_level": "high",
    "publisher": "Youku uploader",
    "author_or_speaker": "倪海厦",
    "discovered_at": "2026-04-24",
    "discovered_via": "web_search:q-site-haokan-sohu-youku-iqiyi",
    "notes": "优酷专辑入口候选；不下载媒体。"
  },
  {
    "source_id": "nhx-youku-tianji-yijing-xntkzmtewnta4na",
    "title": "优酷：倪海厦天纪易学/八卦分集候选",
    "url": "https://v.youku.com/v_show/id_XNTkzMjEwNTA4NA==.html",
    "platform": "youku.com",
    "media_type": "video",
    "topic_tags": ["nihaixia", "tianji", "yijing", "ziwei", "video", "youku", "boundary"],
    "rights_status": "unknown_needs_review",
    "storage_policy": "metadata_only",
    "collection_actions": ["record_metadata", "manual_rights_review", "request_license", "do_not_download_media", "do_not_store_fulltext"],
    "human_review_status": "needs_license",
    "risk_level": "high",
    "publisher": "Youku uploader",
    "author_or_speaker": "倪海厦",
    "discovered_at": "2026-04-24",
    "discovered_via": "web_search:q-site-haokan-sohu-youku-iqiyi",
    "notes": "天纪易学/八卦体系边界候选；只登记 metadata。"
  },
  {
    "source_id": "nhx-iqiyi-tianji-playlist-3466659981679902",
    "title": "爱奇艺：倪海厦天纪播放列表候选",
    "url": "https://www.iqiyi.com/playlist3466659981679902.html",
    "platform": "iqiyi.com",
    "media_type": "webpage",
    "topic_tags": ["nihaixia", "tianji", "ziwei", "video", "iqiyi", "playlist"],
    "rights_status": "unknown_needs_review",
    "storage_policy": "metadata_only",
    "collection_actions": ["record_metadata", "manual_rights_review", "request_license", "do_not_download_media", "do_not_store_fulltext"],
    "human_review_status": "needs_license",
    "risk_level": "high",
    "publisher": "Iqiyi uploader",
    "author_or_speaker": "倪海厦",
    "discovered_at": "2026-04-24",
    "discovered_via": "web_search:q-site-haokan-sohu-youku-iqiyi",
    "notes": "爱奇艺播放列表候选；不下载媒体。"
  }
]
